{"boundaryPolicy":{"neverCross":["heading","table","code","sheet","slide","document"],"oversizeWithoutLegalCut":"QUALITY_CHUNK_BOUNDARY_FAILED","preserveCodeToken":true,"preserveFormula":true,"preserveGraphemeSensitiveToken":true,"preserveMarkdownLink":true,"preserveTableCell":true,"preserveUtf8CodePoint":true},"childChunkIdDomain":"mm-chat.child-chunk-id.v1\n","childTokens":{"hardMaximum":650,"targetMaximum":500,"targetMinimum":350},"derivedContexts":[{"includedInContentHash":true,"includedInSlidingOverlapCount":false,"includedInSourceSpanHash":true,"maxRepeatsPerParent":1,"maxTokensPerOccurrence":1,"reason":"table_header","requiresOriginalSourceMapping":true},{"includedInContentHash":true,"includedInSlidingOverlapCount":false,"includedInSourceSpanHash":true,"maxRepeatsPerParent":1,"maxTokensPerOccurrence":1,"reason":"heading_context","requiresOriginalSourceMapping":true},{"includedInContentHash":true,"includedInSlidingOverlapCount":false,"includedInSourceSpanHash":true,"maxRepeatsPerParent":1,"maxTokensPerOccurrence":1,"reason":"faq_context","requiresOriginalSourceMapping":true}],"fragmentPolicy":{"childSourceRelationToParent":"ordered_subset","emptyFragmentsAllowed":false,"fragmentOrder":"strict_canonical_reading_order","joinerCardinality":"fragment_count_minus_one","locatorClipping":"exact_normalization_segment_boundary_projection","overlapWithinChunkAllowed":false,"rangeConvention":"zero_based_half_open","rangeUnit":"utf8_byte_relative_to_block_text_range"},"joiners":[{"kind":"adjacent","utf8Bytes":""},{"kind":"block_separator","utf8Bytes":"\n\n"}],"parentChunkIdDomain":"mm-chat.parent-chunk-id.v1\n","parentTokens":{"hardMaximum":2000,"targetMaximum":1600,"targetMinimum":1400},"profileClass":"evaluation","profileRevision":1,"readingFlowPolicy":{"crossFlowDerivedContextAllowed":false,"crossFlowJoinerAllowed":false,"crossFlowOverlapAllowed":false,"requireFinalLogicalFlowProof":true,"singleFlowSeedPerChunk":true},"schemaVersion":"chunk-profile.v1","tokenizer":{"name":"x","normalization":{"normalizationConfigSha256":"0000000000000000000000000000000000000000000000000000000000000000","normalizationId":"x"},"revision":"x","specialTokenPolicy":{"addSpecialTokens":false,"allowedSpecialTokens":[],"countSpecialTokens":false},"tokenizerFileSha256":"0000000000000000000000000000000000000000000000000000000000000000","vocabularySha256":"0000000000000000000000000000000000000000000000000000000000000000"},"windowOverlapTokens":{"adjacentChildrenOnly":true,"countDerivedContext":false,"maximum":100,"minimum":60}}